_id,firstName,lastName,age,gender,communicationLevel,difficultyType,preferences[0],currentLevel,notes,assignedParents[0],status,sessionAccessCode,createdBy,trackingPreferences.difficulty,trackingPreferences.recommendationFrequency,trackingPreferences.assignedScenariosMode,trackingPreferences.visualTheme,trackingPreferences.language,createdAt,updatedAt,__v,assignedTherapists[0],trackingPreferences.gridSize,trackingPreferences.childTheme,trackingPreferences.childVoice,trackingPreferences.childPictogramSize,trackingPreferences.childSuggestions,trackingPreferences.childLevel
69e4ec27b473aad666b4e731,ismal,ali,23,M,Niveau 2,ddff,jeux,Niveau 2,,69e36c07d557274a8ba6ba8c,active,IQAMIL12,69e36c07d557274a8ba6ba8c,medium,daily,standard,soft,fr,2026-04-19T14:52:23.299Z,2026-04-19T14:52:23.299Z,0,,,,,,,
69f3e8ce8fd7c094eaeb23d0,Sami,Ben Ali,7,M,Debutant,Communication expressive,,Niveau 1,Sami communique mieux pendant les routines du matin. Il utilise deja quelques demandes simples et repond bien aux renforcements visuels.,69f3e8ce8fd7c094eaeb23cd,active,KID-SAMI01,69f3e8ce8fd7c094eaeb23cd,medium,daily,guided,soft,fr,2026-04-30T23:42:06.768Z,2026-05-28T15:21:01.665Z,0,69f3e8ce8fd7c094eaeb23cb,medium,mint,fr,5,on,Debutant
69f3e8cf8fd7c094eaeb23d1,Aya,Trabelsi,9,F,Intermediaire,Communication sociale,,Niveau 2,Aya est a l'aise avec les routines scolaires et progresse dans l'expression des emotions.,69f3e8ce8fd7c094eaeb23ce,active,KID-AYA02,69f3e8ce8fd7c094eaeb23ce,medium,weekly,standard,soft,fr,2026-04-30T23:42:07.649Z,2026-05-28T15:21:01.674Z,0,69f3e8ce8fd7c094eaeb23cb,medium,sky,fr,4,on,Intermediaire
69f3e8cf8fd7c094eaeb23d2,Nour,Trabelsi,5,F,Debutant,Retard de langage,,Niveau 1,Nour commence a pointer volontairement les pictogrammes besoins et actions.,69f3e8ce8fd7c094eaeb23ce,active,KID-NOUR03,69f3e8ce8fd7c094eaeb23ce,easy,daily,guided,soft,fr,2026-04-30T23:42:07.672Z,2026-05-28T15:21:01.693Z,0,69f3e8ce8fd7c094eaeb23cb,small,peach,fr,5,on,Debutant
69f3e8cf8fd7c094eaeb23d3,Youssef,Kammoun,6,M,Debutant,Demande par pictogrammes,,Niveau 1,Youssef a besoin de sequences tres courtes et d'une repetition forte des pictogrammes de demande.,69f3e8ce8fd7c094eaeb23cf,active,KID-YOUS04,69f3e8ce8fd7c094eaeb23cf,medium,daily,guided,soft,fr,2026-04-30T23:42:07.676Z,2026-05-28T15:21:01.701Z,0,69f3e8ce8fd7c094eaeb23cc,small,sky,fr,5,on,Debutant
69f3e8cf8fd7c094eaeb23d4,Lina,Kammoun,8,F,Intermediaire,Transitions difficiles,,Niveau 2,Lina reussit mieux quand les scenarios sont annonces a l'avance avec supports visuels.,69f3e8ce8fd7c094eaeb23cf,active,KID-LINA05,69f3e8ce8fd7c094eaeb23cf,medium,weekly,standard,soft,fr,2026-04-30T23:42:07.679Z,2026-05-28T15:21:01.708Z,0,69f3e8ce8fd7c094eaeb23cc,medium,lilac,fr,4,on,Intermediaire
69f3e8cf8fd7c094eaeb23d5,Adam,Kammoun,10,M,Avance,Interactions sociales,,Niveau 3,Adam utilise deja des phrases plus longues et travaille surtout les interactions sociales.,69f3e8ce8fd7c094eaeb23cf,active,KID-ADAM06,69f3e8ce8fd7c094eaeb23cf,advanced,weekly,adaptive,soft,fr,2026-04-30T23:42:07.683Z,2026-05-28T15:21:01.713Z,0,69f3e8ce8fd7c094eaeb23cc,large,sky,fr,4,on,Avance
